{"case_id":"PD-C-NURVID-yg9uopmNeUU-01","case_revision":"draft-normalized-r1","case_status":"PENDING","claims":[{"changed_predicate":null,"claim_id":"PD-C-NURVID-yg9uopmNeUU-01-T","matched_to_claim_id":null,"object":"PATIENT_ARM_PUNCTURE_SITE","polarity":"TRUE","predicate":"REMAINS_VISIBLY_INSERTED_AT","source_claim_id":"PD-C-NURVID-yg9uopmNeUU-01-T","subject":"VENIPUNCTURE_NEEDLE","temporal_scope_ref":"evidence_window","text":"Across the selected sampled evidence frames, the venipuncture needle remains visibly inserted at the puncture site on the patient's arm."},{"changed_predicate":"PREDICATE_ONLY","claim_id":"PD-C-NURVID-yg9uopmNeUU-01-F","matched_to_claim_id":"PD-C-NURVID-yg9uopmNeUU-01-T","object":"PATIENT_ARM_PUNCTURE_SITE","polarity":"FALSE","predicate":"REMAINS_VISIBLY_OUTSIDE_AND_SEPARATED_FROM","source_claim_id":"PD-C-NURVID-yg9uopmNeUU-01-F","subject":"VENIPUNCTURE_NEEDLE","temporal_scope_ref":"evidence_window","text":"Across the same sampled evidence frames, the venipuncture needle remains visibly outside and separated from the patient's arm."}],"entities":[{"definition":null,"entity_id":"VENIPUNCTURE_NEEDLE","source_object":null},{"definition":null,"entity_id":"PATIENT_ARM_PUNCTURE_SITE","source_object":null}],"evidence_contract":{"automatic_oracle_access":"FORBIDDEN","coverage_semantics":"DISCRETE_SAMPLED_EVIDENCE_FRAMES","geometry_type":"DYNAMIC_SUPPORT_TUBE","required_evidence_roles":["ARM_PUNCTURE_SITE_TUBE","NEEDLE_SKIN_ENTRY_INTERFACE_TUBE","VENIPUNCTURE_NEEDLE_VISIBLE_SEGMENT_TUBE"]},"format":"relive-v2-protocol-dev-case-v1","frame_locator":{"coverage_semantics":"DISCRETE_SAMPLED_EVIDENCE_FRAMES","dataset_root_key":"NURVID_ROOT","evidence_frame_range":[214,238],"frame_id_scheme":"SAMPLED_FRAME_ID","keyframe_ids":[],"path_status":"PENDING","relative_path_pattern":null,"sampled_frame_ids":[214,216,218,220,222,224,226,228,230,232,234,236,238]},"human_review":{"decision":"ADMIT","rationale":"Across sampled frames 214 through 238, the clinician holds the same venipuncture needle and a persistent visible needle-skin entry interface is present at the patient's arm puncture site.","reviewer_id":null,"source_decision_literal":"ADMIT"},"oracle_annotation":{"artifact_ref":null,"automatic_certificate_access":"FORBIDDEN","coordinates_present":false,"status":"PENDING"},"provenance":{"case_id_structurally_derived":false,"machine_path_issue":null,"normalizer_version":"relive-v2-protocol-dev-normalizer-v1","raw_oracle_status":"PENDING_MANUAL_ANNOTATION","source_draft_sha256":"70042d3a392a768bb0dd770bc5e41c92bd1f62c0755dc3fb36147cf097a03a29","source_object_index":6,"source_object_sha256":"1b16046420cbf807d18f378de0d2861d7384274a3a7544275ee189e447f8dc28","source_parse_issues":["DRAFT_NOT_SINGLE_STRICT_JSON_OBJECT","FULLWIDTH_PUNCTUATION:，","CONCATENATED_TOP_LEVEL_OBJECT"]},"schema_version":"1.0.0","source":{"dataset":"NurViD","source_record_canonical_hashes":[],"source_record_hints":[{"role":null,"source_record_uid_hint":null,"source_sample_id_hint":"yg9uopmNeUU&&28.40&&180.20&&1.0"}],"source_record_uid":null,"source_sample_ids":["yg9uopmNeUU&&28.40&&180.20&&1.0"],"source_task":"tal","video_id":"yg9uopmNeUU"},"split":"protocol_dev","task":{"claim_type":"CONTACT_ACTION","subtype":"NEEDLE_SKIN_INSERTION_STATE"},"temporal_spec":{"after_frame_range":null,"after_window":null,"evidence_window":{"end_seconds":119.0,"start_seconds":107.0},"interaction_frame_range":null,"interaction_window":null,"source_timebase":"PENDING"}}
