{"case_id":"PD-C-EGO-01","case_revision":"draft-normalized-r1","case_status":"PENDING","claims":[{"changed_predicate":null,"claim_id":"PD-C-EGO-01-T","matched_to_claim_id":null,"object":"suction cannula","polarity":"TRUE","predicate":"MAINTAINS_VISIBLE_GRASP_ON","source_claim_id":"PD-C-EGO-01-T","subject":"surgeon's left hand","temporal_scope_ref":"evidence_window","text":"Across the sampled evidence window, the surgeon's left hand maintains a visible grasp on the suction cannula."},{"changed_predicate":"MAINTAINS_VISIBLE_GRASP_ON -> REMAINS_VISIBLY_SEPARATED_FROM","claim_id":"PD-C-EGO-01-F","matched_to_claim_id":"PD-C-EGO-01-T","object":"suction cannula","polarity":"FALSE","predicate":"REMAINS_VISIBLY_SEPARATED_FROM","source_claim_id":"PD-C-EGO-01-F","subject":"surgeon's left hand","temporal_scope_ref":"evidence_window","text":"Across the same sampled evidence window, the surgeon's left hand remains visibly separated from the suction cannula."}],"entities":[{"definition":null,"entity_id":"suction cannula","source_object":"Suction Cannula"},{"definition":null,"entity_id":"surgeon's left hand","source_object":"Own hands left"}],"evidence_contract":{"automatic_oracle_access":"FORBIDDEN","coverage_semantics":"ACROSS_REVIEWED_SAMPLED_WINDOW","geometry_type":null,"required_evidence_roles":["HAND_CANNULA_GRASP_INTERFACE","LEFT_HAND_TUBE","SUCTION_CANNULA_TUBE"]},"format":"relive-v2-protocol-dev-case-v1","frame_locator":{"coverage_semantics":"ACROSS_REVIEWED_SAMPLED_WINDOW","dataset_root_key":"EGOSURGERY_ROOT","evidence_frame_range":null,"frame_id_scheme":"PENDING","keyframe_ids":[529,533,537,541,545,549,553,557],"path_status":"DECLARED_UNVERIFIED","relative_path_pattern":"images/06/06_1_{frame:04d}.jpg","sampled_frame_ids":[]},"human_review":{"decision":"PENDING","rationale":"","reviewer_id":"","source_decision_literal":"REVIEW_REQUIRED"},"oracle_annotation":{"artifact_ref":null,"automatic_certificate_access":"FORBIDDEN","coordinates_present":false,"status":"PENDING"},"provenance":{"case_id_structurally_derived":true,"machine_path_issue":"MACHINE_ROOT_STRIPPED","normalizer_version":"relive-v2-protocol-dev-normalizer-v1","raw_oracle_status":"NOT_ANNOTATED","source_draft_sha256":"70042d3a392a768bb0dd770bc5e41c92bd1f62c0755dc3fb36147cf097a03a29","source_object_index":4,"source_object_sha256":"e9a3aa8f9965d76a2117e1b5a81b47e9fad7e3822c7319d88bf9cc727723bf1d","source_parse_issues":["DRAFT_NOT_SINGLE_STRICT_JSON_OBJECT","FULLWIDTH_PUNCTUATION:，","CONCATENATED_TOP_LEVEL_OBJECT"]},"schema_version":"1.0.0","source":{"dataset":"EgoSurgery","source_record_canonical_hashes":[],"source_record_hints":[{"role":null,"source_record_uid_hint":"medvidu-02203-f26eb27a5038","source_sample_id_hint":"0.5$06_1_part0$460$585"},{"role":null,"source_record_uid_hint":"medvidu-02347-32592ff9a013","source_sample_id_hint":"0.5$06_1_part0$477$617"}],"source_record_uid":null,"source_sample_ids":["0.5$06_1_part0$460$585","0.5$06_1_part0$477$617"],"source_task":"PENDING","video_id":"06_1"},"split":"protocol_dev","task":{"claim_type":"CONTACT_ACTION","subtype":null},"temporal_spec":{"after_frame_range":null,"after_window":null,"evidence_window":null,"interaction_frame_range":null,"interaction_window":null,"source_timebase":"absolute_seconds"}}
