{"case_id":"PD-S-07","case_revision":"draft-normalized-r1","case_status":"INVALID","claims":[{"changed_predicate":null,"claim_id":"PD-S-07-T","matched_to_claim_id":null,"object":"GRASPER_TIP","polarity":"TRUE","predicate":"ABOVE","source_claim_id":"PD-S-07-T","subject":"SCISSORS_TIP","temporal_scope_ref":"evidence_window","text":"Across the selected evidence window, the scissors tip remains visibly above the grasper tip in the image plane."},{"changed_predicate":"ABOVE_TO_BELOW","claim_id":"PD-S-07-F","matched_to_claim_id":"PD-S-VID02-01-T","object":"GRASPER_TIP","polarity":"FALSE","predicate":"BELOW","source_claim_id":"PD-S-07-F","subject":"SCISSORS_TIP","temporal_scope_ref":"evidence_window","text":"Across the same evidence window, the scissors tip remains visibly below the grasper tip in the image plane."}],"entities":[{"definition":"The distal working tip of the scissors, excluding the shaft and trocar-entry region.","entity_id":"SCISSORS_TIP","source_object":"scissors_track_1"},{"definition":"The distal jaw tip of the grasper, excluding the shaft and trocar-entry region.","entity_id":"GRASPER_TIP","source_object":"grasper_track_2"}],"evidence_contract":{"automatic_oracle_access":"FORBIDDEN","coverage_semantics":"RELATION_MUST_HOLD_ACROSS_ALL_ADMISSIBLE_FRAMES","geometry_type":"RELATIONAL_COMPOSITE","required_evidence_roles":["GRASPER_TIP_TUBE","SCISSORS_TIP_TUBE"]},"format":"relive-v2-protocol-dev-case-v1","frame_locator":{"coverage_semantics":"RELATION_MUST_HOLD_ACROSS_ALL_ADMISSIBLE_FRAMES","dataset_root_key":"CHOLECTRACK20_ROOT","evidence_frame_range":[9676,10026],"frame_id_scheme":"PENDING","keyframe_ids":[9676,9726,9826,9926,10026],"path_status":"PENDING","relative_path_pattern":null,"sampled_frame_ids":[]},"human_review":{"decision":"ADMIT","rationale":"Frames 9676 through 10026 form a continuous subwindow in which both instrument tips are visible, their identities remain stable, the scissors tip stays above the grasper tip in the image plane, and no ordering reversal or severe occlusion is observed.","reviewer_id":null,"source_decision_literal":"ADMIT"},"oracle_annotation":{"artifact_ref":null,"automatic_certificate_access":"FORBIDDEN","coordinates_present":false,"status":"PENDING"},"provenance":{"case_id_structurally_derived":false,"machine_path_issue":null,"normalizer_version":"relive-v2-protocol-dev-normalizer-v1","raw_oracle_status":"PENDING_MANUAL_ANNOTATION","source_draft_sha256":"70042d3a392a768bb0dd770bc5e41c92bd1f62c0755dc3fb36147cf097a03a29","source_object_index":3,"source_object_sha256":"2d39d69d86328b467e1065b28792efe2ac6390bd5d071448399ae7f74511bd8f","source_parse_issues":["DRAFT_NOT_SINGLE_STRICT_JSON_OBJECT","FULLWIDTH_PUNCTUATION:，","CONCATENATED_TOP_LEVEL_OBJECT"]},"schema_version":"1.0.0","source":{"dataset":"CholecTrack20","source_record_canonical_hashes":[],"source_record_hints":[],"source_record_uid":null,"source_sample_ids":[],"source_task":"PENDING","video_id":"VID02"},"split":"protocol_dev","task":{"claim_type":"SPATIAL_RELATION","subtype":"RELATIONAL_COMPOSITE"},"temporal_spec":{"after_frame_range":null,"after_window":null,"evidence_window":{"end_seconds":401.04,"start_seconds":387.04},"interaction_frame_range":null,"interaction_window":null,"source_timebase":"ABSOLUTE_VIDEO_SECONDS"}}
