{"case_id":"PD-S-08","case_revision":"draft-normalized-r1","case_status":"PENDING","claims":[{"changed_predicate":null,"claim_id":"PD-S-08-T","matched_to_claim_id":null,"object":null,"polarity":"TRUE","predicate":null,"source_claim_id":null,"subject":null,"temporal_scope_ref":"evidence_window","text":"During the selected evidence interval, the visible knife is located to the right of the visible forceps in the image plane."},{"changed_predicate":"RIGHT_OF -> LEFT_OF","claim_id":"PD-S-08-F","matched_to_claim_id":"PD-S-08-T","object":null,"polarity":"FALSE","predicate":null,"source_claim_id":null,"subject":null,"temporal_scope_ref":"evidence_window","text":"During the same evidence interval, the visible knife is located to the left of the visible forceps in the image plane."}],"entities":[],"evidence_contract":{"automatic_oracle_access":"FORBIDDEN","coverage_semantics":"PENDING","geometry_type":null,"required_evidence_roles":[]},"format":"relive-v2-protocol-dev-case-v1","frame_locator":{"coverage_semantics":"PENDING","dataset_root_key":"COPESD_ROOT","evidence_frame_range":null,"frame_id_scheme":"PENDING","keyframe_ids":[],"path_status":"PENDING","relative_path_pattern":null,"sampled_frame_ids":[]},"human_review":{"decision":"PENDING","rationale":null,"reviewer_id":null,"source_decision_literal":null},"oracle_annotation":{"artifact_ref":null,"automatic_certificate_access":"FORBIDDEN","coordinates_present":false,"status":"PENDING"},"provenance":{"case_id_structurally_derived":true,"machine_path_issue":null,"normalizer_version":"relive-v2-protocol-dev-normalizer-v1","raw_oracle_status":"PENDING","source_draft_sha256":"70042d3a392a768bb0dd770bc5e41c92bd1f62c0755dc3fb36147cf097a03a29","source_object_index":2,"source_object_sha256":"f551bdaebe0054484a3990c813e368a5e47021139a3c4ad8d9aafd77ebb9d8f3","source_parse_issues":["DRAFT_NOT_SINGLE_STRICT_JSON_OBJECT","FULLWIDTH_PUNCTUATION:，","CONCATENATED_TOP_LEVEL_OBJECT"]},"schema_version":"1.0.0","source":{"dataset":"CoPESD","source_record_canonical_hashes":[],"source_record_hints":[{"role":"KNIFE","source_record_uid_hint":"medvidu-01832-72e322b7df31","source_sample_id_hint":"0.5$012626_part0$1408$1518"},{"role":"FORCEPS","source_record_uid_hint":"medvidu-02014-250bd5e8033b","source_sample_id_hint":"0.5$012626_part0$1141$1454"}],"source_record_uid":null,"source_sample_ids":["0.5$012626_part0$1408$1518","0.5$012626_part0$1141$1454"],"source_task":"PENDING","video_id":"012626"},"split":"protocol_dev","task":{"claim_type":"SPATIAL_RELATION","subtype":null},"temporal_spec":{"after_frame_range":null,"after_window":null,"evidence_window":{"end_seconds":1446.0,"start_seconds":1434.0},"interaction_frame_range":null,"interaction_window":null,"source_timebase":"PENDING"}}
