{"case_id":"PD-P-02","case_revision":"draft-normalized-r1","case_status":"PENDING","claims":[{"changed_predicate":null,"claim_id":"PD-P-02-T","matched_to_claim_id":null,"object":"PATIENT_FACIAL_FIXATION_SITE","polarity":"TRUE","predicate":"REMAINS_VISIBLY_FIXED_AT","source_claim_id":"PD-P-02-T","subject":"GASTRIC_TUBE","temporal_scope_ref":"evidence_window","text":"Across the selected post-interaction evidence frames, the gastric tube remains visibly fixed at the patient's facial fixation site."},{"changed_predicate":"REMAINS_VISIBLY_FIXED_AT_TO_REMAINS_VISIBLY_DETACHED_FROM","claim_id":"PD-P-02-F","matched_to_claim_id":"PD-P-02-T","object":"PATIENT_FACIAL_FIXATION_SITE","polarity":"FALSE","predicate":"REMAINS_VISIBLY_DETACHED_FROM","source_claim_id":"PD-P-02-F","subject":"GASTRIC_TUBE","temporal_scope_ref":"evidence_window","text":"Across the same post-interaction evidence frames, the gastric tube remains visibly detached from the patient's facial fixation site."}],"entities":[{"definition":null,"entity_id":"GASTRIC_TUBE","source_object":null},{"definition":null,"entity_id":"PATIENT_FACIAL_FIXATION_SITE","source_object":null}],"evidence_contract":{"automatic_oracle_access":"FORBIDDEN","coverage_semantics":"PENDING","geometry_type":"DYNAMIC_SUPPORT_TUBE","required_evidence_roles":["FIXATION_TAPE_OR_FASTENER_TUBE","GASTRIC_TUBE_LOCAL_SEGMENT_TUBE","PATIENT_FACIAL_FIXATION_SITE_TUBE","TUBE_FIXATION_INTERFACE_TUBE"]},"format":"relive-v2-protocol-dev-case-v1","frame_locator":{"coverage_semantics":"PENDING","dataset_root_key":"NURVID_ROOT","evidence_frame_range":[386,394],"frame_id_scheme":"PENDING","keyframe_ids":[],"path_status":"PENDING","relative_path_pattern":null,"sampled_frame_ids":[386,388,390,392,394]},"human_review":{"decision":"ADMIT","rationale":"The fixation tape is clearly visible. Operator contact ends at frame 382 and both hands are withdrawn by frame 384. Across the clean same-shot postcondition frames 386 through 394, the same gastric tube remains visibly fixed at the same facial fixation site without continuous hand support, detachment, or obvious displacement. Frame 398 confirms the same state after a scene cut but is excluded from automatic evidence.","reviewer_id":null,"source_decision_literal":"ADMIT"},"oracle_annotation":{"artifact_ref":null,"automatic_certificate_access":"FORBIDDEN","coordinates_present":false,"status":"PENDING"},"provenance":{"case_id_structurally_derived":false,"machine_path_issue":null,"normalizer_version":"relive-v2-protocol-dev-normalizer-v1","raw_oracle_status":"PENDING_MANUAL_ANNOTATION","source_draft_sha256":"70042d3a392a768bb0dd770bc5e41c92bd1f62c0755dc3fb36147cf097a03a29","source_object_index":7,"source_object_sha256":"21447c0eff04a048e70e2c8ded78bbc15a8e9938fbe69c16362f721133eda415","source_parse_issues":["DRAFT_NOT_SINGLE_STRICT_JSON_OBJECT","FULLWIDTH_PUNCTUATION:，","CONCATENATED_TOP_LEVEL_OBJECT"]},"schema_version":"1.0.0","source":{"dataset":"NurViD","source_record_canonical_hashes":[],"source_record_hints":[{"role":null,"source_record_uid_hint":"medvidu-00296-4275f3fd2c7f","source_sample_id_hint":"44mJ9VUsGHM&&70.50&&248.50&&1.0"}],"source_record_uid":null,"source_sample_ids":["44mJ9VUsGHM&&70.50&&248.50&&1.0"],"source_task":"tal","video_id":"44mJ9VUsGHM"},"split":"protocol_dev","task":{"claim_type":"POSTCONDITION_PERSISTENCE","subtype":"VISIBLE_TUBE_FIXATION_PERSISTENCE"},"temporal_spec":{"after_frame_range":[386,394],"after_window":{"end_seconds":197.0,"start_seconds":193.0},"evidence_window":{"end_seconds":197.0,"start_seconds":193.0},"interaction_frame_range":[359,382],"interaction_window":{"end_seconds":190.9,"start_seconds":179.2},"source_timebase":"PENDING"}}
