{"case_id":"PD-S-05","case_revision":"draft-normalized-r1","case_status":"PENDING","claims":[{"changed_predicate":null,"claim_id":"PD-S-05-T","matched_to_claim_id":null,"object":null,"polarity":"TRUE","predicate":null,"source_claim_id":null,"subject":null,"temporal_scope_ref":"evidence_window","text":"During 720.04–740.04 seconds of VID110, the center of the visible hook is below the center of the visible grasper in the image plane."},{"changed_predicate":"BELOW -> ABOVE","claim_id":"PD-S-05-F","matched_to_claim_id":"PD-S-05-T","object":null,"polarity":"FALSE","predicate":null,"source_claim_id":null,"subject":null,"temporal_scope_ref":"evidence_window","text":"During 720.04–740.04 seconds of VID110, the center of the visible hook is above the center of the visible grasper in the image plane."}],"entities":[],"evidence_contract":{"automatic_oracle_access":"FORBIDDEN","coverage_semantics":"PENDING","geometry_type":null,"required_evidence_roles":[]},"format":"relive-v2-protocol-dev-case-v1","frame_locator":{"coverage_semantics":"PENDING","dataset_root_key":"CHOLECTRACK20_ROOT","evidence_frame_range":[18001,18501],"frame_id_scheme":"PENDING","keyframe_ids":[],"path_status":"PENDING","relative_path_pattern":null,"sampled_frame_ids":[]},"human_review":{"decision":"ADMIT","rationale":"Both instruments are simultaneously visible with stable identities, no severe occlusion, and an unambiguous below/above relationship throughout the selected interval.","reviewer_id":null,"source_decision_literal":"ADMIT"},"oracle_annotation":{"artifact_ref":null,"automatic_certificate_access":"FORBIDDEN","coordinates_present":false,"status":"PENDING"},"provenance":{"case_id_structurally_derived":true,"machine_path_issue":null,"normalizer_version":"relive-v2-protocol-dev-normalizer-v1","raw_oracle_status":"PENDING","source_draft_sha256":"70042d3a392a768bb0dd770bc5e41c92bd1f62c0755dc3fb36147cf097a03a29","source_object_index":1,"source_object_sha256":"5cbc0c4ba830fefa6e45fc9a73449755870612e29b25488d5a719b041860e09a","source_parse_issues":["DRAFT_NOT_SINGLE_STRICT_JSON_OBJECT","FULLWIDTH_PUNCTUATION:，"]},"schema_version":"1.0.0","source":{"dataset":"CholecTrack20","source_record_canonical_hashes":[],"source_record_hints":[{"role":"HOOK","source_record_uid_hint":"medvidu-02022-476f43f70838","source_sample_id_hint":"1.0$VID110$16501$21076"},{"role":"GRASPER","source_record_uid_hint":"medvidu-02472-448b340a36b6","source_sample_id_hint":"1.0$VID110$16501$20326"}],"source_record_uid":null,"source_sample_ids":["1.0$VID110$16501$21076","1.0$VID110$16501$20326"],"source_task":"PENDING","video_id":"VID110"},"split":"protocol_dev","task":{"claim_type":"SPATIAL_RELATION","subtype":null},"temporal_spec":{"after_frame_range":null,"after_window":null,"evidence_window":{"end_seconds":740.04,"start_seconds":720.04},"interaction_frame_range":[18001,18701],"interaction_window":null,"source_timebase":"PENDING"}}
