{"case_id":"PD-C-AVOS-DHFI6YnauIM-01","case_revision":"draft-normalized-r1","case_status":"PENDING","claims":[{"changed_predicate":null,"claim_id":"PD-C-AVOS-DHFI6YnauIM-01-T","matched_to_claim_id":null,"object":"SUTURE_NEEDLE","polarity":"TRUE","predicate":"MAINTAINS_VISIBLE_GRASP_ON","source_claim_id":"PD-C-AVOS-DHFI6YnauIM-01-T","subject":"NEEDLE_HOLDER_JAWS","temporal_scope_ref":"evidence_window","text":"Across the selected sampled evidence frames, the needle holder's jaws maintain a visible grasp on the suture needle."},{"changed_predicate":"MAINTAINS_VISIBLE_GRASP_ON_TO_REMAINS_VISIBLY_SEPARATED_FROM","claim_id":"PD-C-AVOS-DHFI6YnauIM-01-F","matched_to_claim_id":"PD-C-AVOS-DHFI6YnauIM-01-T","object":"SUTURE_NEEDLE","polarity":"FALSE","predicate":"REMAINS_VISIBLY_SEPARATED_FROM","source_claim_id":"PD-C-AVOS-DHFI6YnauIM-01-F","subject":"NEEDLE_HOLDER_JAWS","temporal_scope_ref":"evidence_window","text":"Across the same sampled evidence frames, the needle holder's jaws remain visibly separated from the suture needle."}],"entities":[{"definition":"The distal jaws of the needle holder, excluding the shaft and operator hand.","entity_id":"NEEDLE_HOLDER_JAWS","source_object":null},{"definition":"The visible suture needle or the visible needle segment held between the jaws, excluding the suture thread.","entity_id":"SUTURE_NEEDLE","source_object":null}],"evidence_contract":{"automatic_oracle_access":"FORBIDDEN","coverage_semantics":"DISCRETE_SAMPLED_EVIDENCE_FRAMES","geometry_type":"DYNAMIC_SUPPORT_TUBE","required_evidence_roles":["JAW_NEEDLE_GRASP_INTERFACE_TUBE","NEEDLE_HOLDER_JAWS_TUBE","SUTURE_NEEDLE_TUBE"]},"format":"relive-v2-protocol-dev-case-v1","frame_locator":{"coverage_semantics":"DISCRETE_SAMPLED_EVIDENCE_FRAMES","dataset_root_key":"AVOS_ROOT","evidence_frame_range":[16710,16758],"frame_id_scheme":"NATIVE_FRAME_ID","keyframe_ids":[],"path_status":"PENDING","relative_path_pattern":null,"sampled_frame_ids":[16710,16726,16742,16758]},"human_review":{"decision":"ADMIT","rationale":"In sampled frames 16710, 16726, 16742, and 16758, the needle-holder jaws and the same suture needle are both visible, and the jaws maintain a stable visible grasp configuration without release, identity change, or severe occlusion.","reviewer_id":null,"source_decision_literal":"ADMIT"},"oracle_annotation":{"artifact_ref":null,"automatic_certificate_access":"FORBIDDEN","coordinates_present":false,"status":"PENDING"},"provenance":{"case_id_structurally_derived":false,"machine_path_issue":null,"normalizer_version":"relive-v2-protocol-dev-normalizer-v1","raw_oracle_status":"PENDING_MANUAL_ANNOTATION","source_draft_sha256":"70042d3a392a768bb0dd770bc5e41c92bd1f62c0755dc3fb36147cf097a03a29","source_object_index":5,"source_object_sha256":"96d7a0d4ed818d93da23708b1fae6e2f1f1c4e252ea5500a6135d2a8d85898b9","source_parse_issues":["DRAFT_NOT_SINGLE_STRICT_JSON_OBJECT","FULLWIDTH_PUNCTUATION:，","CONCATENATED_TOP_LEVEL_OBJECT"]},"schema_version":"1.0.0","source":{"dataset":"AVOS","source_record_canonical_hashes":[],"source_record_hints":[{"role":null,"source_record_uid_hint":null,"source_sample_id_hint":"DHFI6YnauIM&&16696&&17699&&1.0"}],"source_record_uid":null,"source_sample_ids":["DHFI6YnauIM&&16696&&17699&&1.0"],"source_task":"tal","video_id":"DHFI6YnauIM"},"split":"protocol_dev","task":{"claim_type":"CONTACT_ACTION","subtype":"DYNAMIC_SUPPORT_TUBE"},"temporal_spec":{"after_frame_range":null,"after_window":null,"evidence_window":{"end_seconds":1117.2,"start_seconds":1114.0},"interaction_frame_range":null,"interaction_window":null,"source_timebase":"PENDING"}}
