{"case_id":"PD-P-AVOS-Tg3Pg6f-mjg-01","case_revision":"draft-normalized-r1","case_status":"PENDING","claims":[{"changed_predicate":null,"claim_id":"PD-P-AVOS-Tg3Pg6f-mjg-01-T","matched_to_claim_id":null,"object":null,"polarity":"TRUE","predicate":"REMAINS_VISIBLY_OPEN","source_claim_id":null,"subject":"resulting excision site","temporal_scope_ref":"evidence_window","text":"After the excised tissue is removed, the resulting excision site remains visibly open across the selected post-state frames before suturing begins."},{"changed_predicate":null,"claim_id":"PD-P-AVOS-Tg3Pg6f-mjg-01-F","matched_to_claim_id":"PD-P-AVOS-Tg3Pg6f-mjg-01-T","object":null,"polarity":"FALSE","predicate":"IS_VISIBLY_CLOSED","source_claim_id":null,"subject":"resulting excision site","temporal_scope_ref":"evidence_window","text":"After the excised tissue is removed, the resulting excision site is visibly closed across the same post-state frames before suturing begins."}],"entities":[{"definition":null,"entity_id":"resulting excision site","source_object":null}],"evidence_contract":{"automatic_oracle_access":"FORBIDDEN","coverage_semantics":"PENDING","geometry_type":null,"required_evidence_roles":[]},"format":"relive-v2-protocol-dev-case-v1","frame_locator":{"coverage_semantics":"PENDING","dataset_root_key":"AVOS_ROOT","evidence_frame_range":[3642,3691],"frame_id_scheme":"PENDING","keyframe_ids":[3642,3658,3674,3690,3691],"path_status":"PENDING","relative_path_pattern":null,"sampled_frame_ids":[]},"human_review":{"decision":"PENDING","rationale":"The excised tissue is visibly removed by frame 3626. The resulting open excision site remains visible in multiple subsequent frames. Retractors are present in the early post-state but absent by frames 3690-3691, while the incision remains visible. New instruments enter at frame 3720 and suturing begins at frame 3749, so those frames are excluded from the primary post-state evidence.","reviewer_id":null,"source_decision_literal":"ACCEPT_POSTCONDITION_CANDIDATE"},"oracle_annotation":{"artifact_ref":null,"automatic_certificate_access":"FORBIDDEN","coordinates_present":false,"status":"PENDING"},"provenance":{"case_id_structurally_derived":true,"machine_path_issue":null,"normalizer_version":"relive-v2-protocol-dev-normalizer-v1","raw_oracle_status":"PENDING","source_draft_sha256":"70042d3a392a768bb0dd770bc5e41c92bd1f62c0755dc3fb36147cf097a03a29","source_object_index":8,"source_object_sha256":"8034c7598be4fba9a162d892d11fe6d9da1757cdc7aae1d1649b697fb7e0a737","source_parse_issues":["DRAFT_NOT_SINGLE_STRICT_JSON_OBJECT","FULLWIDTH_PUNCTUATION:，","CONCATENATED_TOP_LEVEL_OBJECT"]},"schema_version":"1.0.0","source":{"dataset":"AVOS","source_record_canonical_hashes":[],"source_record_hints":[{"role":null,"source_record_uid_hint":null,"source_sample_id_hint":"Tg3Pg6f-mjg&&2626&&4260&&1.0"}],"source_record_uid":null,"source_sample_ids":["Tg3Pg6f-mjg&&2626&&4260&&1.0"],"source_task":"PENDING","video_id":"Tg3Pg6f-mjg"},"split":"protocol_dev","task":{"claim_type":"POSTCONDITION_PERSISTENCE","subtype":null},"temporal_spec":{"after_frame_range":[3642,3691],"after_window":null,"evidence_window":null,"interaction_frame_range":null,"interaction_window":null,"source_timebase":"PENDING"}}
