{"case_id":"PD-P-CholecT50-VID68-GBPACK-01","case_revision":"draft-normalized-r1","case_status":"PENDING","claims":[{"changed_predicate":null,"claim_id":"PD-P-CholecT50-VID68-GBPACK-01-T","matched_to_claim_id":null,"object":"specimen bag","polarity":"TRUE","predicate":null,"source_claim_id":null,"subject":"gallbladder","temporal_scope_ref":"evidence_window","text":"After the specimen-bag opening is tightened, the gallbladder remains visibly contained within the specimen bag across the selected post-action frames."},{"changed_predicate":null,"claim_id":"PD-P-CholecT50-VID68-GBPACK-01-F","matched_to_claim_id":"PD-P-CholecT50-VID68-GBPACK-01-T","object":"specimen bag","polarity":"FALSE","predicate":null,"source_claim_id":null,"subject":"gallbladder","temporal_scope_ref":"evidence_window","text":"After the specimen-bag opening is tightened, the gallbladder is visibly outside and spatially separate from the specimen bag across the same post-action frames."}],"entities":[{"definition":null,"entity_id":"gallbladder","source_object":null},{"definition":null,"entity_id":"specimen bag","source_object":null}],"evidence_contract":{"automatic_oracle_access":"FORBIDDEN","coverage_semantics":"PENDING","geometry_type":"RELATIONAL_COMPOSITE_TUBE","required_evidence_roles":["CONTAINMENT_INTERFACE_TUBE","GALLBLADDER_SPECIMEN_TUBE","SPECIMEN_BAG_TUBE"]},"format":"relive-v2-protocol-dev-case-v1","frame_locator":{"coverage_semantics":"PENDING","dataset_root_key":"CHOLECT50_ROOT","evidence_frame_range":null,"frame_id_scheme":"PENDING","keyframe_ids":[],"path_status":"PENDING","relative_path_pattern":null,"sampled_frame_ids":[]},"human_review":{"decision":"PENDING","rationale":null,"reviewer_id":null,"source_decision_literal":"PROVISIONALLY_ACCEPT_POSTCONDITION_CANDIDATE"},"oracle_annotation":{"artifact_ref":null,"automatic_certificate_access":"FORBIDDEN","coordinates_present":false,"status":"PENDING"},"provenance":{"case_id_structurally_derived":true,"machine_path_issue":null,"normalizer_version":"relive-v2-protocol-dev-normalizer-v1","raw_oracle_status":"PENDING","source_draft_sha256":"70042d3a392a768bb0dd770bc5e41c92bd1f62c0755dc3fb36147cf097a03a29","source_object_index":9,"source_object_sha256":"12393968cdf31c84cf03f21e4b9430c21ae1383e1b0866ba28e3abe9cfec487b","source_parse_issues":["DRAFT_NOT_SINGLE_STRICT_JSON_OBJECT","FULLWIDTH_PUNCTUATION:，","CONCATENATED_TOP_LEVEL_OBJECT"]},"schema_version":"1.0.0","source":{"dataset":"CholecT50","source_record_canonical_hashes":[],"source_record_hints":[{"role":null,"source_record_uid_hint":null,"source_sample_id_hint":"0.1$VID68$103$1888"}],"source_record_uid":null,"source_sample_ids":["0.1$VID68$103$1888"],"source_task":"PENDING","video_id":"VID68"},"split":"protocol_dev","task":{"claim_type":"POSTCONDITION_PERSISTENCE","subtype":"RELATIONAL_COMPOSITE_TUBE"},"temporal_spec":{"after_frame_range":[1683,1691],"after_window":null,"evidence_window":null,"interaction_frame_range":[1643,1682],"interaction_window":null,"source_timebase":"PENDING"}}
